1.用种子 1、2 和 3 运行,并计算进程生成的每个虚拟地址是处于界限内还是界限外? 如果在界限内,请计算地址转换。
fang@fang:~/code/Operating Systream/Relocation$ python3 relocation.py -s 1 -c

ARG seed 1
ARG address space size 1k
ARG phys mem size 16k

Base-and-Bounds register information:

  Base   : 0x0000363c (decimal 13884)
  Limit  : 290

Virtual Address Trace
  VA  0: 0x0000030e (decimal:  782) --> SEGMENTATION VIOLATION
  VA  1: 0x00000105 (decimal:  261) --> VALID: 0x00003741 (decimal: 14145)
  VA  2: 0x000001fb (decimal:  507) --> SEGMENTATION VIOLATION
  VA  3: 0x000001cc (decimal:  460) --> SEGMENTATION VIOLATION
  VA  4: 0x0000029b (decimal:  667) --> SEGMENTATION VIOLATION

fang@fang:~/code/Operating Systream/Relocation$ python3 relocation.py -s 2 -c

ARG seed 2
ARG address space size 1k
ARG phys mem size 16k

Base-and-Bounds register information:

  Base   : 0x00003ca9 (decimal 15529)
  Limit  : 500

Virtual Address Trace
  VA  0: 0x00000039 (decimal:   57) --> VALID: 0x00003ce2 (decimal: 15586)
  VA  1: 0x00000056 (decimal:   86) --> VALID: 0x00003cff (decimal: 15615)
  VA  2: 0x00000357 (decimal:  855) --> SEGMENTATION VIOLATION
  VA  3: 0x000002f1 (decimal:  753) --> SEGMENTATION VIOLATION
  VA  4: 0x000002ad (decimal:  685) --> SEGMENTATION VIOLATION

  fang@fang:~/code/Operating Systream/Relocation$ python3 relocation.py -s 3 -c

ARG seed 3
ARG address space size 1k
ARG phys mem size 16k

Base-and-Bounds register information:

  Base   : 0x000022d4 (decimal 8916)
  Limit  : 316

Virtual Address Trace
  VA  0: 0x0000017a (decimal:  378) --> SEGMENTATION VIOLATION
  VA  1: 0x0000026a (decimal:  618) --> SEGMENTATION VIOLATION
  VA  2: 0x00000280 (decimal:  640) --> SEGMENTATION VIOLATION
  VA  3: 0x00000043 (decimal:   67) --> VALID: 0x00002317 (decimal: 8983)
  VA  4: 0x0000000d (decimal:   13) --> VALID: 0x000022e1 (decimal: 8929)

2.使用以下标志运行:-s 0 -n 10。为了确保所有生成的虚拟地址都处于边界内,要将(界限寄存器)设置为什么值?
fang@fang:~/code/Operating Systream/Relocation$ python3 relocation.py -s 0 -n 10 -l 930 -c

ARG seed 0
ARG address space size 1k
ARG phys mem size 16k

Base-and-Bounds register information:

  Base   : 0x0000360b (decimal 13835)
  Limit  : 930

Virtual Address Trace
  VA  0: 0x00000308 (decimal:  776) --> VALID: 0x00003913 (decimal: 14611)
  VA  1: 0x000001ae (decimal:  430) --> VALID: 0x000037b9 (decimal: 14265)
  VA  2: 0x00000109 (decimal:  265) --> VALID: 0x00003714 (decimal: 14100)
  VA  3: 0x0000020b (decimal:  523) --> VALID: 0x00003816 (decimal: 14358)
  VA  4: 0x0000019e (decimal:  414) --> VALID: 0x000037a9 (decimal: 14249)
  VA  5: 0x00000322 (decimal:  802) --> VALID: 0x0000392d (decimal: 14637)
  VA  6: 0x00000136 (decimal:  310) --> VALID: 0x00003741 (decimal: 14145)
  VA  7: 0x000001e8 (decimal:  488) --> VALID: 0x000037f3 (decimal: 14323)
  VA  8: 0x00000255 (decimal:  597) --> VALID: 0x00003860 (decimal: 14432)
  VA  9: 0x000003a1 (decimal:  929) --> VALID: 0x000039ac (decimal: 14764)

3.使用以下标志运行:-s 1 -n 10 -l 100。可以设置界限的最大值是多少,以便地址空间仍然完全放在物理内存中?
物理内存大小为 16*1024 比特,
要是地址完全放在物理内存中,
界限寄存器最大值为 16*1024 - 100 = 16284
fang@fang:~/code/Operating Systream/Relocation$ python3 relocation.py -s 1 -n 10 -l 16284 -c

ARG seed 1
ARG address space size 1k
ARG phys mem size 16k

Base-and-Bounds register information:

  Base   : 0x00000022 (decimal 34)
  Limit  : 16284

Virtual Address Trace
  VA  0: 0x000001c8 (decimal:  456) --> VALID: 0x000001ea (decimal:  490)
  VA  1: 0x000002e2 (decimal:  738) --> VALID: 0x00000304 (decimal:  772)
  VA  2: 0x000000ea (decimal:  234) --> VALID: 0x0000010c (decimal:  268)
  VA  3: 0x000003c7 (decimal:  967) --> VALID: 0x000003e9 (decimal: 1001)
  VA  4: 0x0000039b (decimal:  923) --> VALID: 0x000003bd (decimal:  957)
  VA  5: 0x0000001f (decimal:   31) --> VALID: 0x00000041 (decimal:   65)
  VA  6: 0x0000001a (decimal:   26) --> VALID: 0x0000003c (decimal:   60)
  VA  7: 0x0000022a (decimal:  554) --> VALID: 0x0000024c (decimal:  588)
  VA  8: 0x000003c1 (decimal:  961) --> VALID: 0x000003e3 (decimal:  995)
  VA  9: 0x00000186 (decimal:  390) --> VALID: 0x000001a8 (decimal:  424)

4.运行和第 3 题相同的操作,但使用较大的地址空间(-a)和物理内存(-p)

5.作为界限寄存器的值的函数,随机生成的虚拟地址的哪一部分是有效的?画一个图,使用不同随机种子运行,限制值从 0 到最大地址空间大小。